{
  "schema_version": 1,
  "run_date": "2026-10-07",
  "checked_at": "2026-10-07T21:30:00+03:00",
  "sources": {
    "jobs": [
      "Remotive API (returned only 17 jobs)",
      "RemoteOK API",
      "Himalayas API (including searches filtered to Kenya)",
      "Jobicy API",
      "We Work Remotely RSS",
      "Working Nomads",
      "employer job pages on Greenhouse, Lever and Recruitee",
      "web search (DOU.ua, OpenTrain, Jobgether)"
    ],
    "news": [
      "Mistral",
      "Google",
      "Reflection AI",
      "GitLab",
      "TechCabal",
      "TechCrunch",
      "Disrupt Africa",
      "The Condia",
      "The Star (AP)",
      "Boston Globe",
      "Safaricom",
      "Techweez"
    ]
  },
  "counts": {
    "pulled": 1060,
    "pulled_is_approximate": true,
    "filtered_out": {
      "older_than_30_days": 150,
      "senior_title": 250,
      "not_target_role": 400,
      "location_or_timezone": null
    },
    "filtered_out_is_approximate": true,
    "reviewed_closely": 33,
    "shortlisted": 10,
    "dropped": 23,
    "dropped_by_reason": {
      "location": 11,
      "experience": 8,
      "stale": 1,
      "closed": 1,
      "stack": 1,
      "requirement": 1
    },
    "stories": 12
  },
  "method": {
    "filtering_summary": "Of about 1,060 postings pulled, about 150 were more than 30 days old, about 250 had senior, lead or manager titles, about 400 weren’t target roles, and most of the rest were limited to the US, EU or LATAM, or to time zones that exclude UTC+3."
  },
  "jobs": [
    {
      "rank": 1,
      "tier": "top",
      "url": "https://job-boards.greenhouse.io/canonical/jobs/8249005",
      "title": "Graduate Software Engineer, Open Source and Linux, Canonical Ubuntu",
      "company": "Canonical",
      "location_as_stated": "Home based - Worldwide (teams aligned to EMEA/APAC/AMER time zones)",
      "posted": "2026-10-05",
      "salary_as_shown": "Not shown",
      "experience_asked": "2025 and 2026 graduates; \"outstanding results in your academic career\"",
      "found_via": "Greenhouse API (found while verifying Canonical roles from Himalayas/Jobicy)",
      "verified": "Greenhouse API, live 2026-10-07",
      "note": "Made for a new CS grad. Python is one of their main languages. Very competitive, with a long written application and assessment process. They put weight on grades.",
      "fit": "Built for 2025/2026 CS graduates, and Python is one of Canonical's main languages.",
      "gaps": "Very competitive process with a long written application and assessments. They put weight on academic results.",
      "id": "j-3092215902f8"
    },
    {
      "rank": 2,
      "tier": "top",
      "url": "https://www.opentrain.ai/jobs/associate-forward-deployed-engineer--cmu4m3lrf001s0bgmqcoe18er/",
      "title": "Associate Forward Deployed Engineer",
      "company": "micro1",
      "location_as_stated": "53 listed countries including Kenya (KE); \"this role is not worldwide\"",
      "posted": "2026-09-16",
      "salary_as_shown": "$40-$60/hour",
      "experience_asked": "Entry level; basic Python, SQL, APIs, Git",
      "found_via": "Himalayas API (verified on OpenTrain listing for micro1)",
      "verified": "OpenTrain page, validThrough 2026-11-06",
      "note": "Junior work on data ingestion and integrations, using Python, SQL and APIs. Matches his Chumz data-ops and Kwara integrations work. Part-time contract (20+ hrs/week), not salaried. The micro1-hosted page could not be fetched.",
      "fit": "Entry-level data loading and integration work in Python, SQL and APIs. Matches his Chumz data-ops and Kwara integrations work.",
      "gaps": "Part-time contract (20+ hrs/week), not salaried. Checked on OpenTrain's copy of the listing because micro1's own page wouldn't load.",
      "id": "j-6a4b29c4cbcc"
    },
    {
      "rank": 3,
      "tier": "top",
      "url": "https://jobs.dou.ua/companies/spendbase/vacancies/375752/",
      "title": "Junior AI Automation Engineer (CEO Office)",
      "company": "Spendbase",
      "location_as_stated": "\"Kyiv, Lviv, abroad, remote\" (Kenya not named)",
      "posted": "2026-10-06",
      "salary_as_shown": "\"Competitive salary\" (no figure)",
      "experience_asked": "0-2 years; Claude Code + MCP, LangChain/n8n-type agents, APIs/webhooks, basic Python/JS, English B2+",
      "found_via": "Web search (DOU.ua)",
      "verified": "DOU page live 2026-10-07",
      "note": "Closest match to what he does now: building AI agents, webhooks and API integrations at a fintech startup. Gap: Google Workspace automation is not on his CV. Ask them to confirm that \"abroad\" includes Kenya.",
      "fit": "Closest match to his current work: AI agents (Claude Code, MCP, LangChain/n8n-type), webhooks and API integrations at a fintech startup, 0–2 years.",
      "gaps": "Google Workspace automation isn't on his CV. Kenya isn't named, so confirm that \"abroad\" includes it.",
      "id": "j-1968cd5732e2"
    },
    {
      "rank": 4,
      "tier": "evergreen",
      "url": "https://job-boards.greenhouse.io/canonical/jobs/5143074",
      "title": "Python Engineer",
      "company": "Canonical",
      "location_as_stated": "Home based - Worldwide; \"remote Python engineering roles in every time zone\"",
      "posted": "Himalayas listed 2026-09-19 (Greenhouse req first published 2023-10-11, updated 2026-08-05)",
      "salary_as_shown": "Not shown",
      "experience_asked": "All levels of seniority; strong academics; Linux experience",
      "found_via": "Himalayas API",
      "verified": "Greenhouse API, live 2026-10-07",
      "note": "General Python track that hires at every level, so a junior can apply. Gap: Linux (Debian/Ubuntu) experience is not on his CV. This is an always-open listing that gets reposted, not a new job.",
      "fit": "A general Python listing that hires at every level of seniority, in every time zone.",
      "gaps": "Linux (Debian/Ubuntu) experience isn't on his CV. Always-open listing that gets reposted, not a new job.",
      "id": "j-abc3d7e3668c"
    },
    {
      "rank": 5,
      "tier": "evergreen",
      "url": "https://job-boards.eu.greenhouse.io/amplemarket/jobs/4066973101",
      "title": "Fullstack Software Engineer",
      "company": "Amplemarket",
      "location_as_stated": "Remote, EMEA/LATAM (Himalayas lists Kenya)",
      "posted": "Himalayas listed 2026-09-18 (Greenhouse req published 2022, still open)",
      "salary_as_shown": "Not shown",
      "experience_asked": "Not stated; WTTJ lists Junior/Mid/Senior; \"We don't require you to have experience in our stack\"",
      "found_via": "Himalayas API",
      "verified": "Greenhouse page live 2026-10-07",
      "note": "YC-backed AI sales startup, matching his preference for fast-moving startups. He has React and PostgreSQL. Gap: their backend is Ruby on Rails, Elasticsearch and Redis.",
      "fit": "Fast-moving startup backed by Y Combinator. He has React and PostgreSQL, and the posting says experience in their stack isn't required.",
      "gaps": "Backend is Ruby on Rails, Elasticsearch and Redis. Always-open listing (since 2022).",
      "id": "j-20366aec7caa"
    },
    {
      "rank": 6,
      "tier": "stretch",
      "url": "https://weworkremotely.com/remote-jobs/sticker-mule-ai-agent-engineer",
      "title": "AI agent engineer",
      "company": "Sticker Mule",
      "location_as_stated": "Anywhere in the World (applicant countries list includes KE)",
      "posted": "2026-09-16 (valid through 2026-10-16)",
      "salary_as_shown": "$150,000-$250,000 USD + $20,000 signing bonus",
      "experience_asked": "Not stated; \"Experience building agents that run on their own\"",
      "found_via": "We Work Remotely RSS (also on Remotive/RemoteOK)",
      "verified": "WWR page live 2026-10-07",
      "note": "Matches his agentic and LLM work, plus TypeScript and Postgres. Gaps: Go, GraphQL and GCP. The pay suggests they want experienced people. Closes about Oct 16.",
      "fit": "Matches his AI agent work, TypeScript and Postgres.",
      "gaps": "Go, GraphQL and GCP aren't on his CV. The pay suggests they want someone experienced. Closes about Oct 16.",
      "id": "j-fc1624dbfb10"
    },
    {
      "rank": 7,
      "tier": "stretch",
      "url": "https://careers.tether.io/o/backend-engineer-wallets-100-remote-hn",
      "title": "Backend Engineer - Wallets (100% Remote Worldwide)",
      "company": "Tether",
      "location_as_stated": "100% Remote Worldwide",
      "posted": "2026-09-10 (republished; Himalayas 2026-09-13 and 2026-10-07)",
      "salary_as_shown": "Not shown",
      "experience_asked": "Not stated in years; Recruitee tags it \"experienced\"; \"Very proficient in Node.js\"",
      "found_via": "Himalayas API",
      "verified": "Tether Recruitee API, live 2026-10-07",
      "note": "Fintech backend with microservices and APIs, close to his Kwara work. Big gap: they want strong Node.js, and his backend is Python. Several copies of this listing are open.",
      "fit": "Fintech backend with microservices and APIs, close to his Kwara work.",
      "gaps": "Wants someone \"very proficient in Node.js\", and his backend work is in Python. Tagged \"experienced\".",
      "id": "j-76e09d32cb04"
    },
    {
      "rank": 8,
      "tier": "stretch",
      "url": "https://weworkremotely.com/remote-jobs/steuart-nutrition-software-developer-ai-coding",
      "title": "Software Developer AI Coding",
      "company": "Steuart Nutrition",
      "location_as_stated": "Anywhere in the World; must overlap 4+ hrs/day with US Eastern",
      "posted": "2026-09-23",
      "salary_as_shown": "Not shown",
      "experience_asked": "3+ years professional",
      "found_via": "We Work Remotely RSS",
      "verified": "WWR page live 2026-10-07",